{"contract_version":1,"capture_id":"sha256:4aa281b97de9afa09d74ff0f5c41e9f6c4fc2b7b07ddf314f33b55d2fec95afc","source_file":"tests/corpus/corpus_capture_02.pcapng","sessions":[{"session_id":"s1","endpoints":[{"ip":"10.0.0.1","port":40021},{"ip":"10.0.0.2","port":9000}],"role_a":"client","role_b":"server","syn_seen":true,"fin_seen":true,"rst_seen":false,"isn_a":100000,"isn_b":200000,"first_ts":1700086400.001,"last_ts":1700086400.044997,"packet_indices":[0,1,2,3,4,5,6,7,8,9,10,11,12,13,14,15,16,17,18,19,20,21,22,23,24,25,26,27,28,29,30,31,32,33,34,35,36,37,38,39,40,41,42,43,44],"reassembled_from":[],"directions":{"A_to_B":{"bytes_b64":"AQAAARABAAABFgEAAAEQAQAAARYBAAABEAEAAAEWAQAAARABAAABFgEAAAEQAQAAARYBAAABEAEAAAEWAQAAARABAAABFgEAAAEQAQAAARYBAAABEAEAAAEWAQAAARABAAABFg==","provenance":[{"offset":0,"length":5,"packet_index":3,"seq":100001,"ts":1700086400.004},{"offset":5,"length":5,"packet_index":5,"seq":100006,"ts":1700086400.006},{"offset":10,"length":5,"packet_index":7,"seq":100011,"ts":1700086400.008},{"offset":15,"length":5,"packet_index":9,"seq":100016,"ts":1700086400.009999},{"offset":20,"length":5,"packet_index":11,"seq":100021,"ts":1700086400.011999},{"offset":25,"length":5,"packet_index":13,"seq":100026,"ts":1700086400.013999},{"offset":30,"length":5,"packet_index":15,"seq":100031,"ts":1700086400.015999},{"offset":35,"length":5,"packet_index":17,"seq":100036,"ts":1700086400.017999},{"offset":40,"length":5,"packet_index":19,"seq":100041,"ts":1700086400.019998},{"offset":45,"length":5,"packet_index":21,"seq":100046,"ts":1700086400.021998},{"offset":50,"length":5,"packet_index":23,"seq":100051,"ts":1700086400.023998},{"offset":55,"length":5,"packet_index":25,"seq":100056,"ts":1700086400.025998},{"offset":60,"length":5,"packet_index":27,"seq":100061,"ts":1700086400.027998},{"offset":65,"length":5,"packet_index":29,"seq":100066,"ts":1700086400.029998},{"offset":70,"length":5,"packet_index":31,"seq":100071,"ts":1700086400.031998},{"offset":75,"length":5,"packet_index":33,"seq":100076,"ts":1700086400.033998},{"offset":80,"length":5,"packet_index":35,"seq":100081,"ts":1700086400.035998},{"offset":85,"length":5,"packet_index":37,"seq":100086,"ts":1700086400.037997},{"offset":90,"length":5,"packet_index":39,"seq":100091,"ts":1700086400.039997},{"offset":95,"length":5,"packet_index":41,"seq":100096,"ts":1700086400.041997}],"diagnostics":[]},"B_to_A":{"bytes_b64":"AQAAAxAcVgEAAAMWHwEBAAADEB0aAQAAAxYWVgEAAAMQFkUBAAADFhy8AQAAAxARzAEAAAMWHbABAAADEB4qAQAAAxYecAEAAAMQEScBAAADFhpuAQAAAxAWcwEAAAMWF5kBAAADEB/RAQAAAxYWJgEAAAMQHN8BAAADFhp0AQAAAxAfPAEAAAMWFBs=","provenance":[{"offset":0,"length":7,"packet_index":4,"seq":200001,"ts":1700086400.005},{"offset":7,"length":7,"packet_index":6,"seq":200008,"ts":1700086400.007},{"offset":14,"length":7,"packet_index":8,"seq":200015,"ts":1700086400.008999},{"offset":21,"length":7,"packet_index":10,"seq":200022,"ts":1700086400.010999},{"offset":28,"length":7,"packet_index":12,"seq":200029,"ts":1700086400.012999},{"offset":35,"length":7,"packet_index":14,"seq":200036,"ts":1700086400.014999},{"offset":42,"length":7,"packet_index":16,"seq":200043,"ts":1700086400.016999},{"offset":49,"length":7,"packet_index":18,"seq":200050,"ts":1700086400.018998},{"offset":56,"length":7,"packet_index":20,"seq":200057,"ts":1700086400.020998},{"offset":63,"length":7,"packet_index":22,"seq":200064,"ts":1700086400.022998},{"offset":70,"length":7,"packet_index":24,"seq":200071,"ts":1700086400.024998},{"offset":77,"length":7,"packet_index":26,"seq":200078,"ts":1700086400.026998},{"offset":84,"length":7,"packet_index":28,"seq":200085,"ts":1700086400.028998},{"offset":91,"length":7,"packet_index":30,"seq":200092,"ts":1700086400.030998},{"offset":98,"length":7,"packet_index":32,"seq":200099,"ts":1700086400.032998},{"offset":105,"length":7,"packet_index":34,"seq":200106,"ts":1700086400.034998},{"offset":112,"length":7,"packet_index":36,"seq":200113,"ts":1700086400.036997},{"offset":119,"length":7,"packet_index":38,"seq":200120,"ts":1700086400.038997},{"offset":126,"length":7,"packet_index":40,"seq":200127,"ts":1700086400.040997},{"offset":133,"length":7,"packet_index":42,"seq":200134,"ts":1700086400.042997}],"diagnostics":[]}}},{"session_id":"s2","endpoints":[{"ip":"10.0.0.1","port":40028},{"ip":"10.0.0.2","port":9000}],"role_a":"client","role_b":"server","syn_seen":true,"fin_seen":true,"rst_seen":false,"isn_a":110000,"isn_b":210000,"first_ts":1700086401.045997,"last_ts":1700086401.089994,"packet_indices":[45,46,47,48,49,50,51,52,53,54,55,56,57,58,59,60,61,62,63,64,65,66,67,68,69,70,71,72,73,74,75,76,77,78,79,80,81,82,83,84,85,86,87,88,89],"reassembled_from":[],"directions":{"A_to_B":{"bytes_b64":"AgAAAxEKtwIAAAMSC1gCAAADEQ9ZAgAAAxIPOwIAAAMRDmoCAAADEgR+AgAAAxEMQwIAAAMSB+ICAAADEQf5AgAAAxILDgIAAAMRC3MCAAADEgvIAgAAAxEIPQIAAAMSBKMCAAADEQa9AgAAAxIN7wIAAAMRBYECAAADEgSGAgAAAxEJ/AIAAAMSCBM=","provenance":[{"offset":0,"length":7,"packet_index":48,"seq":110001,"ts":1700086401.048996},{"offset":7,"length":7,"packet_index":50,"seq":110008,"ts":1700086401.050996},{"offset":14,"length":7,"packet_index":52,"seq":110015,"ts":1700086401.052996},{"offset":21,"length":7,"packet_index":54,"seq":110022,"ts":1700086401.054996},{"offset":28,"length":7,"packet_index":56,"seq":110029,"ts":1700086401.056996},{"offset":35,"length":7,"packet_index":58,"seq":110036,"ts":1700086401.058996},{"offset":42,"length":7,"packet_index":60,"seq":110043,"ts":1700086401.060996},{"offset":49,"length":7,"packet_index":62,"seq":110050,"ts":1700086401.062996},{"offset":56,"length":7,"packet_index":64,"seq":110057,"ts":1700086401.064995},{"offset":63,"length":7,"packet_index":66,"seq":110064,"ts":1700086401.066995},{"offset":70,"length":7,"packet_index":68,"seq":110071,"ts":1700086401.068995},{"offset":77,"length":7,"packet_index":70,"seq":110078,"ts":1700086401.070995},{"offset":84,"length":7,"packet_index":72,"seq":110085,"ts":1700086401.072995},{"offset":91,"length":7,"packet_index":74,"seq":110092,"ts":1700086401.074994},{"offset":98,"length":7,"packet_index":76,"seq":110099,"ts":1700086401.076994},{"offset":105,"length":7,"packet_index":78,"seq":110106,"ts":1700086401.078994},{"offset":112,"length":7,"packet_index":80,"seq":110113,"ts":1700086401.080994},{"offset":119,"length":7,"packet_index":82,"seq":110120,"ts":1700086401.082994},{"offset":126,"length":7,"packet_index":84,"seq":110127,"ts":1700086401.084994},{"offset":133,"length":7,"packet_index":86,"seq":110134,"ts":1700086401.086994}],"diagnostics":[]},"B_to_A":{"bytes_b64":"AgAAAxEKtwIAAAMSC1gCAAADEQ9ZAgAAAxIPOwIAAAMRDmoCAAADEgR+AgAAAxEMQwIAAAMSB+ICAAADEQf5AgAAAxILDgIAAAMRC3MCAAADEgvIAgAAAxEIPQIAAAMSBKMCAAADEQa9AgAAAxIN7wIAAAMRBYECAAADEgSGAgAAAxEJ/AIAAAMSCBM=","provenance":[{"offset":0,"length":7,"packet_index":49,"seq":210001,"ts":1700086401.049996},{"offset":7,"length":7,"packet_index":51,"seq":210008,"ts":1700086401.051996},{"offset":14,"length":7,"packet_index":53,"seq":210015,"ts":1700086401.053996},{"offset":21,"length":7,"packet_index":55,"seq":210022,"ts":1700086401.055996},{"offset":28,"length":7,"packet_index":57,"seq":210029,"ts":1700086401.057996},{"offset":35,"length":7,"packet_index":59,"seq":210036,"ts":1700086401.059996},{"offset":42,"length":7,"packet_index":61,"seq":210043,"ts":1700086401.061996},{"offset":49,"length":7,"packet_index":63,"seq":210050,"ts":1700086401.063995},{"offset":56,"length":7,"packet_index":65,"seq":210057,"ts":1700086401.065995},{"offset":63,"length":7,"packet_index":67,"seq":210064,"ts":1700086401.067995},{"offset":70,"length":7,"packet_index":69,"seq":210071,"ts":1700086401.069995},{"offset":77,"length":7,"packet_index":71,"seq":210078,"ts":1700086401.071995},{"offset":84,"length":7,"packet_index":73,"seq":210085,"ts":1700086401.073995},{"offset":91,"length":7,"packet_index":75,"seq":210092,"ts":1700086401.075994},{"offset":98,"length":7,"packet_index":77,"seq":210099,"ts":1700086401.077994},{"offset":105,"length":7,"packet_index":79,"seq":210106,"ts":1700086401.079994},{"offset":112,"length":7,"packet_index":81,"seq":210113,"ts":1700086401.081994},{"offset":119,"length":7,"packet_index":83,"seq":210120,"ts":1700086401.083994},{"offset":126,"length":7,"packet_index":85,"seq":210127,"ts":1700086401.085994},{"offset":133,"length":7,"packet_index":87,"seq":210134,"ts":1700086401.087994}],"diagnostics":[]}}}]}
