{"contract_version":1,"capture_id":"sha256:ae93a5b22380874e743459ef68216249283eec4ee2bfcd96d01953319cdff0ce","source_file":"tests/corpus/corpus_capture_defects.pcapng","sessions":[{"session_id":"s1","endpoints":[{"ip":"10.0.0.1","port":40035},{"ip":"10.0.0.2","port":9000}],"role_a":"client","role_b":"server","syn_seen":true,"fin_seen":true,"rst_seen":false,"isn_a":300000,"isn_b":400000,"first_ts":1700172800.001,"last_ts":1700172800.009999,"packet_indices":[0,1,2,3,4,5,6,7,8,9,10,11,12,13,14,15,16,17],"reassembled_from":[],"directions":{"A_to_B":{"bytes_b64":"AQAAARABAAABEQIAAAMTAMgBAAMAAAEg","provenance":[{"offset":0,"length":5,"packet_index":3,"seq":300001,"ts":1700172800.004},{"offset":5,"length":5,"packet_index":5,"seq":300006,"ts":1700172800.006},{"offset":5,"length":5,"packet_index":7,"seq":300006,"ts":1700172800.007},{"offset":10,"length":3,"packet_index":9,"seq":300011,"ts":1700172800.008},{"offset":13,"length":4,"packet_index":8,"seq":300014,"ts":1700172800.009},{"offset":17,"length":2,"packet_index":11,"seq":300018,"ts":1700172800.011},{"offset":19,"length":5,"packet_index":13,"seq":300022,"ts":1700172800.013}],"diagnostics":[{"type":"gap","offset":19,"length":2,"detail":"missing 2 bytes between seq 300020 and 300022"}]},"B_to_A":{"bytes_b64":"AQAAAxABAwEAAAMRBNICAAADEwDIAQAAAxIDCQMAABIgCAevBjwC8AhHDL4FCw0cDyE=","provenance":[{"offset":0,"length":7,"packet_index":4,"seq":400001,"ts":1700172800.005},{"offset":7,"length":7,"packet_index":6,"seq":400008,"ts":1700172800.006},{"offset":14,"length":7,"packet_index":10,"seq":400015,"ts":1700172800.007},{"offset":21,"length":7,"packet_index":12,"seq":400022,"ts":1700172800.008},{"offset":28,"length":22,"packet_index":14,"seq":400029,"ts":1700172800.014}],"diagnostics":[{"type":"ambiguity","offset":32,"length":2,"packet_index":15,"detail":"conflicting overlap at seq 400033: kept 2008, rejected ffff"}]}}}]}
